{
  "schemaVersion": 1,
  "packageId": "show.sand_ripples",
  "assetId": "show.sand_ripples",
  "presetId": "energized",
  "label": "Energized",
  "description": "State-preserving energized controls for Sand Ripples.",
  "parameters": {
    "speed": 1.15,
    "bpmSync": true,
    "bpmMultiplier": 1,
    "scale": 0.92,
    "rotationDeg": 0,
    "transportRate": 2.3,
    "windDirectionDeg": 12,
    "hopLength": 0.19,
    "reposeSlope": 0.025,
    "relaxationRate": 1.5,
    "reliefScale": 1.7,
    "tiltDeg": 48,
    "ridgeContrast": 1.5,
    "colorR": 0.8,
    "colorG": 0.37,
    "colorB": 0.12,
    "accentR": 1,
    "accentG": 0.86,
    "accentB": 0.46
  }
}
