{
  "schemaVersion": 1,
  "packageId": "show.vortex_advection",
  "assetId": "show.vortex_advection",
  "presetId": "calm",
  "label": "Calm",
  "description": "State-preserving calm controls for Vortex Advection.",
  "parameters": {
    "speed": 0.35,
    "bpmSync": true,
    "bpmMultiplier": 1,
    "scale": 0.92,
    "rotationDeg": 0,
    "circulation": 0.65,
    "coreRadius": 0.085,
    "strain": 0.05,
    "vortexDrift": 0.15,
    "trailTimeSec": 1.3,
    "lineWidth": 1.3,
    "colorR": 0.05,
    "colorG": 0.8,
    "colorB": 1,
    "accentR": 0.95,
    "accentG": 0.18,
    "accentB": 0.52
  }
}
