{
  "schemaVersion": 1,
  "packageId": "show.gerstner_ocean",
  "assetId": "show.gerstner_ocean",
  "presetId": "calm",
  "label": "Calm",
  "description": "Calm Gerstner Ocean settings. Presets preserve current simulation history.",
  "parameters": {
    "speed": 0.28,
    "bpmSync": true,
    "bpmMultiplier": 1,
    "scale": 1,
    "yawDeg": -24,
    "tiltDeg": 38,
    "spinRate": 0,
    "waveHeight": 0.08,
    "wavelength": 2.5,
    "steepness": 0.4,
    "directionDeg": 18,
    "wireOpacity": 0.08,
    "colorR": 0.025,
    "colorG": 0.12,
    "colorB": 0.22,
    "highlightR": 0.38,
    "highlightG": 0.88,
    "highlightB": 0.8
  }
}
