{
  "schemaVersion": 1,
  "packageId": "show.vortex_advection",
  "assetId": "show.vortex_advection",
  "presetId": "default",
  "label": "Default",
  "description": "State-preserving default controls for Vortex Advection.",
  "parameters": {
    "speed": 0.8,
    "bpmSync": true,
    "bpmMultiplier": 1,
    "scale": 0.92,
    "rotationDeg": 0,
    "circulation": 1,
    "coreRadius": 0.085,
    "strain": 0.18,
    "vortexDrift": 0.4,
    "trailTimeSec": 1.1,
    "lineWidth": 1.3,
    "colorR": 0.05,
    "colorG": 0.8,
    "colorB": 1,
    "accentR": 0.95,
    "accentG": 0.18,
    "accentB": 0.52
  }
}
