{
  "schemaVersion": 1,
  "packageId": "show.strange_attractor",
  "assetId": "show.strange_attractor",
  "presetId": "calm",
  "label": "Calm",
  "description": "Calm Strange Attractor settings. Presets preserve current simulation history.",
  "parameters": {
    "speed": 0.32,
    "bpmSync": true,
    "bpmMultiplier": 1,
    "scale": 1,
    "yawDeg": -24,
    "tiltDeg": 38,
    "spinRate": 1.5,
    "sigma": 10,
    "rho": 26,
    "beta": 2.666666667,
    "trailSeconds": 6,
    "ribbonWidth": 0.004,
    "colorR": 0.08,
    "colorG": 0.38,
    "colorB": 0.8,
    "highlightR": 0.65,
    "highlightG": 0.98,
    "highlightB": 0.9
  }
}
