{
  "schemaVersion": 1,
  "packageId": "show.differential_growth",
  "assetId": "show.differential_growth",
  "presetId": "default",
  "label": "Default",
  "description": "Default Differential Growth operating point; ordinary parameter changes preserve state.",
  "parameters": {
    "speed": 1.0,
    "paused": false,
    "bpmSync": false,
    "bpmMultiplier": 1.0,
    "seed": 104729.0,
    "reseed": false,
    "scale": 0.96,
    "rotationDeg": 0.0,
    "lineWidth": 1.6,
    "glow": 1.0,
    "colorR": 0.28,
    "colorG": 0.94,
    "colorB": 0.73,
    "accentR": 0.95,
    "accentG": 0.59,
    "accentB": 0.24,
    "growthRate": 0.34,
    "repulsion": 0.95,
    "stiffness": 0.8,
    "confinement": 0.55,
    "driftRate": 0.12
  }
}
