{
  "schemaVersion": 1,
  "packageId": "show.wave_tank",
  "assetId": "show.wave_tank",
  "presetId": "energized",
  "label": "Energized",
  "description": "Does not change seed or reset simulation history.",
  "parameters": {
    "speed": 1.2,
    "paused": false,
    "bpmSync": true,
    "bpmMultiplier": 1.0,
    "scale": 0.94,
    "rotationDeg": 0.0,
    "colorR": 0.08,
    "colorG": 0.72,
    "colorB": 1.0,
    "waveSpeed": 16.0,
    "damping": 0.3,
    "driveStrength": 9.0,
    "driveFrequency": 1.4,
    "sourceSpread": 0.9,
    "radiance": 1.5,
    "contourCount": 12.0,
    "contourOpacity": 0.55
  }
}
